{
  "uri": "https://grip.opdrachtgever.example/id/opdracht/3f2a8c54-6d1b-4f0e-9a77-1c2b3d4e5f60",
  "name": "Opdracht Alfa",
  "description": "Fictieve opdracht.",
  "kind": "external",
  "client": {
    "tooi_uri": "https://identifier.overheid.nl/tooi/id/ministerie/mnre0000",
    "name": "Voorbeeldministerie",
    "unit_key": "directie-voorbeeld",
    "instance_uri": "https://grip.opdrachtgever.example"
  },
  "contractor": {
    "tooi_uri": "https://identifier.overheid.nl/tooi/id/oorg/oorg00000",
    "name": "Voorbeelddienst",
    "unit_key": "voorbeeldgilde",
    "instance_uri": "https://grip.opdrachtnemer.example"
  },
  "status": "in_progress",
  "period": {
    "start_date": "2026-07-01",
    "end_date": "2027-06-30"
  },
  "parent_assignment_uri": null,
  "context_refs": [
    "https://corpus.voorbeeldministerie.example/id/node/0b6f1c1e-5a0e-4a53-9a43-0d3e1d6b2a03",
    "https://corpus.anderministerie.example/id/node/7c1d2f3a-1111-4222-8333-444455556666"
  ]
}
